{
  "region": "mbh",
  "vars": [
    "chl",
    "sst",
    "uv"
  ],
  "frames": {
    "chl": [
      {
        "var": "chl",
        "id": "mbh_chl_grid_750m",
        "label": "mbh_chl_grid_750m",
        "time_iso": null,
        "json_path": "data/mbh/chl/mbh_chl_grid_750m.json"
      },
      {
        "var": "chl",
        "id": "mbh_2025336.1742_20251202_chl_VJ2",
        "label": "12/02/2025, 17:42",
        "time_iso": "2025-12-02T17:42:00Z",
        "json_path": "data/mbh/chl/mbh_2025336.1742_20251202_chl_VJ2.json"
      },
      {
        "var": "chl",
        "id": "mbh_2025336.1812_20251202_chl_VNP",
        "label": "12/02/2025, 18:12",
        "time_iso": "2025-12-02T18:12:00Z",
        "json_path": "data/mbh/chl/mbh_2025336.1812_20251202_chl_VNP.json"
      },
      {
        "var": "chl",
        "id": "mbh_2025336.1830_20251202_chl_VJ1",
        "label": "12/02/2025, 18:30",
        "time_iso": "2025-12-02T18:30:00Z",
        "json_path": "data/mbh/chl/mbh_2025336.1830_20251202_chl_VJ1.json"
      },
      {
        "var": "chl",
        "id": "mbh_2025336.1836_20251202_chl_VJ1",
        "label": "12/02/2025, 18:36",
        "time_iso": "2025-12-02T18:36:00Z",
        "json_path": "data/mbh/chl/mbh_2025336.1836_20251202_chl_VJ1.json"
      },
      {
        "var": "chl",
        "id": "mbh_2025337.1724_20251203_chl_VJ2",
        "label": "12/03/2025, 17:24",
        "time_iso": "2025-12-03T17:24:00Z",
        "json_path": "data/mbh/chl/mbh_2025337.1724_20251203_chl_VJ2.json"
      },
      {
        "var": "chl",
        "id": "mbh_2025337.1754_20251203_chl_VNP",
        "label": "12/03/2025, 17:54",
        "time_iso": "2025-12-03T17:54:00Z",
        "json_path": "data/mbh/chl/mbh_2025337.1754_20251203_chl_VNP.json"
      },
      {
        "var": "chl",
        "id": "mbh_2025337.1812_20251203_chl_VJ1",
        "label": "12/03/2025, 18:12",
        "time_iso": "2025-12-03T18:12:00Z",
        "json_path": "data/mbh/chl/mbh_2025337.1812_20251203_chl_VJ1.json"
      },
      {
        "var": "chl",
        "id": "mbh_2025337.1906_20251203_chl_VJ2",
        "label": "12/03/2025, 19:06",
        "time_iso": "2025-12-03T19:06:00Z",
        "json_path": "data/mbh/chl/mbh_2025337.1906_20251203_chl_VJ2.json"
      },
      {
        "var": "chl",
        "id": "mbh_2025338.1706_20251204_chl_VJ2",
        "label": "12/04/2025, 17:06",
        "time_iso": "2025-12-04T17:06:00Z",
        "json_path": "data/mbh/chl/mbh_2025338.1706_20251204_chl_VJ2.json"
      },
      {
        "var": "chl",
        "id": "mbh_2025338.1736_20251204_chl_VNP",
        "label": "12/04/2025, 17:36",
        "time_iso": "2025-12-04T17:36:00Z",
        "json_path": "data/mbh/chl/mbh_2025338.1736_20251204_chl_VNP.json"
      },
      {
        "var": "chl",
        "id": "mbh_2025338.1754_20251204_chl_VJ1",
        "label": "12/04/2025, 17:54",
        "time_iso": "2025-12-04T17:54:00Z",
        "json_path": "data/mbh/chl/mbh_2025338.1754_20251204_chl_VJ1.json"
      },
      {
        "var": "chl",
        "id": "mbh_2025338.1848_20251204_chl_VJ2",
        "label": "12/04/2025, 18:48",
        "time_iso": "2025-12-04T18:48:00Z",
        "json_path": "data/mbh/chl/mbh_2025338.1848_20251204_chl_VJ2.json"
      },
      {
        "var": "chl",
        "id": "mbh_2025338.1912_20251204_chl_VNP",
        "label": "12/04/2025, 19:12",
        "time_iso": "2025-12-04T19:12:00Z",
        "json_path": "data/mbh/chl/mbh_2025338.1912_20251204_chl_VNP.json"
      },
      {
        "var": "chl",
        "id": "mbh_2025338.1918_20251204_chl_VNP",
        "label": "12/04/2025, 19:18",
        "time_iso": "2025-12-04T19:18:00Z",
        "json_path": "data/mbh/chl/mbh_2025338.1918_20251204_chl_VNP.json"
      },
      {
        "var": "chl",
        "id": "mbh_2025339.1718_20251205_chl_VNP",
        "label": "12/05/2025, 17:18",
        "time_iso": "2025-12-05T17:18:00Z",
        "json_path": "data/mbh/chl/mbh_2025339.1718_20251205_chl_VNP.json"
      },
      {
        "var": "chl",
        "id": "mbh_2025339.1736_20251205_chl_VJ1",
        "label": "12/05/2025, 17:36",
        "time_iso": "2025-12-05T17:36:00Z",
        "json_path": "data/mbh/chl/mbh_2025339.1736_20251205_chl_VJ1.json"
      },
      {
        "var": "chl",
        "id": "mbh_2025339.1824_20251205_chl_VJ2",
        "label": "12/05/2025, 18:24",
        "time_iso": "2025-12-05T18:24:00Z",
        "json_path": "data/mbh/chl/mbh_2025339.1824_20251205_chl_VJ2.json"
      },
      {
        "var": "chl",
        "id": "mbh_2025339.1830_20251205_chl_VJ2",
        "label": "12/05/2025, 18:30",
        "time_iso": "2025-12-05T18:30:00Z",
        "json_path": "data/mbh/chl/mbh_2025339.1830_20251205_chl_VJ2.json"
      },
      {
        "var": "chl",
        "id": "mbh_2025339.1918_20251205_chl_VJ1",
        "label": "12/05/2025, 19:18",
        "time_iso": "2025-12-05T19:18:00Z",
        "json_path": "data/mbh/chl/mbh_2025339.1918_20251205_chl_VJ1.json"
      },
      {
        "var": "chl",
        "id": "mbh_2025340.1718_20251206_chl_VJ1",
        "label": "12/06/2025, 17:18",
        "time_iso": "2025-12-06T17:18:00Z",
        "json_path": "data/mbh/chl/mbh_2025340.1718_20251206_chl_VJ1.json"
      },
      {
        "var": "chl",
        "id": "mbh_2025340.1806_20251206_chl_VJ2",
        "label": "12/06/2025, 18:06",
        "time_iso": "2025-12-06T18:06:00Z",
        "json_path": "data/mbh/chl/mbh_2025340.1806_20251206_chl_VJ2.json"
      },
      {
        "var": "chl",
        "id": "mbh_2025340.1836_20251206_chl_VNP",
        "label": "12/06/2025, 18:36",
        "time_iso": "2025-12-06T18:36:00Z",
        "json_path": "data/mbh/chl/mbh_2025340.1836_20251206_chl_VNP.json"
      },
      {
        "var": "chl",
        "id": "mbh_2025340.1900_20251206_chl_VJ1",
        "label": "12/06/2025, 19:00",
        "time_iso": "2025-12-06T19:00:00Z",
        "json_path": "data/mbh/chl/mbh_2025340.1900_20251206_chl_VJ1.json"
      },
      {
        "var": "chl",
        "id": "mbh_2025341.1748_20251207_chl_VJ2",
        "label": "12/07/2025, 17:48",
        "time_iso": "2025-12-07T17:48:00Z",
        "json_path": "data/mbh/chl/mbh_2025341.1748_20251207_chl_VJ2.json"
      },
      {
        "var": "chl",
        "id": "mbh_2025341.1818_20251207_chl_VNP",
        "label": "12/07/2025, 18:18",
        "time_iso": "2025-12-07T18:18:00Z",
        "json_path": "data/mbh/chl/mbh_2025341.1818_20251207_chl_VNP.json"
      },
      {
        "var": "chl",
        "id": "mbh_2025341.1842_20251207_chl_VJ1",
        "label": "12/07/2025, 18:42",
        "time_iso": "2025-12-07T18:42:00Z",
        "json_path": "data/mbh/chl/mbh_2025341.1842_20251207_chl_VJ1.json"
      },
      {
        "var": "chl",
        "id": "mbh_2025342.1730_20251208_chl_VJ2",
        "label": "12/08/2025, 17:30",
        "time_iso": "2025-12-08T17:30:00Z",
        "json_path": "data/mbh/chl/mbh_2025342.1730_20251208_chl_VJ2.json"
      },
      {
        "var": "chl",
        "id": "mbh_2025342.1818_20251208_chl_VJ1",
        "label": "12/08/2025, 18:18",
        "time_iso": "2025-12-08T18:18:00Z",
        "json_path": "data/mbh/chl/mbh_2025342.1818_20251208_chl_VJ1.json"
      },
      {
        "var": "chl",
        "id": "mbh_2025342.1824_20251208_chl_VJ1",
        "label": "12/08/2025, 18:24",
        "time_iso": "2025-12-08T18:24:00Z",
        "json_path": "data/mbh/chl/mbh_2025342.1824_20251208_chl_VJ1.json"
      },
      {
        "var": "chl",
        "id": "mbh_2025342.1912_20251208_chl_VJ2",
        "label": "12/08/2025, 19:12",
        "time_iso": "2025-12-08T19:12:00Z",
        "json_path": "data/mbh/chl/mbh_2025342.1912_20251208_chl_VJ2.json"
      },
      {
        "var": "chl",
        "id": "mbh_2025343.1712_20251209_chl_VJ2",
        "label": "12/09/2025, 17:12",
        "time_iso": "2025-12-09T17:12:00Z",
        "json_path": "data/mbh/chl/mbh_2025343.1712_20251209_chl_VJ2.json"
      },
      {
        "var": "chl",
        "id": "mbh_2025343.1742_20251209_chl_VNP",
        "label": "12/09/2025, 17:42",
        "time_iso": "2025-12-09T17:42:00Z",
        "json_path": "data/mbh/chl/mbh_2025343.1742_20251209_chl_VNP.json"
      },
      {
        "var": "chl",
        "id": "mbh_2025343.1800_20251209_chl_VJ1",
        "label": "12/09/2025, 18:00",
        "time_iso": "2025-12-09T18:00:00Z",
        "json_path": "data/mbh/chl/mbh_2025343.1800_20251209_chl_VJ1.json"
      },
      {
        "var": "chl",
        "id": "mbh_2025343.1854_20251209_chl_VJ2",
        "label": "12/09/2025, 18:54",
        "time_iso": "2025-12-09T18:54:00Z",
        "json_path": "data/mbh/chl/mbh_2025343.1854_20251209_chl_VJ2.json"
      },
      {
        "var": "chl",
        "id": "mbh_2025343.1924_20251209_chl_VNP",
        "label": "12/09/2025, 19:24",
        "time_iso": "2025-12-09T19:24:00Z",
        "json_path": "data/mbh/chl/mbh_2025343.1924_20251209_chl_VNP.json"
      },
      {
        "var": "chl",
        "id": "mbh_2025344.1724_20251210_chl_VNP",
        "label": "12/10/2025, 17:24",
        "time_iso": "2025-12-10T17:24:00Z",
        "json_path": "data/mbh/chl/mbh_2025344.1724_20251210_chl_VNP.json"
      },
      {
        "var": "chl",
        "id": "mbh_2025344.1742_20251210_chl_VJ1",
        "label": "12/10/2025, 17:42",
        "time_iso": "2025-12-10T17:42:00Z",
        "json_path": "data/mbh/chl/mbh_2025344.1742_20251210_chl_VJ1.json"
      },
      {
        "var": "chl",
        "id": "mbh_2025344.1830_20251210_chl_VJ2",
        "label": "12/10/2025, 18:30",
        "time_iso": "2025-12-10T18:30:00Z",
        "json_path": "data/mbh/chl/mbh_2025344.1830_20251210_chl_VJ2.json"
      },
      {
        "var": "chl",
        "id": "mbh_2025344.1836_20251210_chl_VJ2",
        "label": "12/10/2025, 18:36",
        "time_iso": "2025-12-10T18:36:00Z",
        "json_path": "data/mbh/chl/mbh_2025344.1836_20251210_chl_VJ2.json"
      },
      {
        "var": "chl",
        "id": "mbh_2025344.1900_20251210_chl_VNP",
        "label": "12/10/2025, 19:00",
        "time_iso": "2025-12-10T19:00:00Z",
        "json_path": "data/mbh/chl/mbh_2025344.1900_20251210_chl_VNP.json"
      },
      {
        "var": "chl",
        "id": "mbh_2025345.1724_20251211_chl_VJ1",
        "label": "12/11/2025, 17:24",
        "time_iso": "2025-12-11T17:24:00Z",
        "json_path": "data/mbh/chl/mbh_2025345.1724_20251211_chl_VJ1.json"
      },
      {
        "var": "chl",
        "id": "mbh_2025345.1812_20251211_chl_VJ2",
        "label": "12/11/2025, 18:12",
        "time_iso": "2025-12-11T18:12:00Z",
        "json_path": "data/mbh/chl/mbh_2025345.1812_20251211_chl_VJ2.json"
      },
      {
        "var": "chl",
        "id": "mbh_2025345.1842_20251211_chl_VNP",
        "label": "12/11/2025, 18:42",
        "time_iso": "2025-12-11T18:42:00Z",
        "json_path": "data/mbh/chl/mbh_2025345.1842_20251211_chl_VNP.json"
      },
      {
        "var": "chl",
        "id": "mbh_2025345.1906_20251211_chl_VJ1",
        "label": "12/11/2025, 19:06",
        "time_iso": "2025-12-11T19:06:00Z",
        "json_path": "data/mbh/chl/mbh_2025345.1906_20251211_chl_VJ1.json"
      }
    ],
    "sst": [
      {
        "var": "sst",
        "id": "sst_grid_mbh_g19",
        "label": "sst_grid_mbh_g19",
        "time_iso": null,
        "json_path": "data/mbh/sst/sst_grid_mbh_g19.json"
      },
      {
        "var": "sst",
        "id": "sstcomp_mbh_2025340_20251206_03_g19_c01",
        "label": "sstcomp_mbh_2025340_20251206_03_g19_c01",
        "time_iso": null,
        "json_path": "data/mbh/sst/sstcomp_mbh_2025340_20251206_03_g19_c01.json"
      },
      {
        "var": "sst",
        "id": "sstcomp_mbh_2025340_20251206_10_g19_c02",
        "label": "sstcomp_mbh_2025340_20251206_10_g19_c02",
        "time_iso": null,
        "json_path": "data/mbh/sst/sstcomp_mbh_2025340_20251206_10_g19_c02.json"
      },
      {
        "var": "sst",
        "id": "sstcomp_mbh_2025340_20251206_15_g19_c03",
        "label": "sstcomp_mbh_2025340_20251206_15_g19_c03",
        "time_iso": null,
        "json_path": "data/mbh/sst/sstcomp_mbh_2025340_20251206_15_g19_c03.json"
      },
      {
        "var": "sst",
        "id": "sstcomp_mbh_2025340_20251206_17_g19_c04",
        "label": "sstcomp_mbh_2025340_20251206_17_g19_c04",
        "time_iso": null,
        "json_path": "data/mbh/sst/sstcomp_mbh_2025340_20251206_17_g19_c04.json"
      },
      {
        "var": "sst",
        "id": "sstcomp_mbh_2025340_20251206_20_g19_c05",
        "label": "sstcomp_mbh_2025340_20251206_20_g19_c05",
        "time_iso": null,
        "json_path": "data/mbh/sst/sstcomp_mbh_2025340_20251206_20_g19_c05.json"
      },
      {
        "var": "sst",
        "id": "sstcomp_mbh_2025341_20251207_06_g19_c06",
        "label": "sstcomp_mbh_2025341_20251207_06_g19_c06",
        "time_iso": null,
        "json_path": "data/mbh/sst/sstcomp_mbh_2025341_20251207_06_g19_c06.json"
      },
      {
        "var": "sst",
        "id": "sstcomp_mbh_2025341_20251207_22_g19_c07",
        "label": "sstcomp_mbh_2025341_20251207_22_g19_c07",
        "time_iso": null,
        "json_path": "data/mbh/sst/sstcomp_mbh_2025341_20251207_22_g19_c07.json"
      },
      {
        "var": "sst",
        "id": "sst_mbh_2025338_20251204_00_g19",
        "label": "12/04/2025, 00:00",
        "time_iso": "2025-12-04T00:00:00Z",
        "json_path": "data/mbh/sst/sst_mbh_2025338_20251204_00_g19.json"
      },
      {
        "var": "sst",
        "id": "sst_mbh_2025338_20251204_01_g19",
        "label": "12/04/2025, 01:00",
        "time_iso": "2025-12-04T01:00:00Z",
        "json_path": "data/mbh/sst/sst_mbh_2025338_20251204_01_g19.json"
      },
      {
        "var": "sst",
        "id": "sst_mbh_2025338_20251204_02_g19",
        "label": "12/04/2025, 02:00",
        "time_iso": "2025-12-04T02:00:00Z",
        "json_path": "data/mbh/sst/sst_mbh_2025338_20251204_02_g19.json"
      },
      {
        "var": "sst",
        "id": "sst_mbh_2025338_20251204_03_g19",
        "label": "12/04/2025, 03:00",
        "time_iso": "2025-12-04T03:00:00Z",
        "json_path": "data/mbh/sst/sst_mbh_2025338_20251204_03_g19.json"
      },
      {
        "var": "sst",
        "id": "sst_mbh_2025338_20251204_04_g19",
        "label": "12/04/2025, 04:00",
        "time_iso": "2025-12-04T04:00:00Z",
        "json_path": "data/mbh/sst/sst_mbh_2025338_20251204_04_g19.json"
      },
      {
        "var": "sst",
        "id": "sst_mbh_2025338_20251204_05_g19",
        "label": "12/04/2025, 05:00",
        "time_iso": "2025-12-04T05:00:00Z",
        "json_path": "data/mbh/sst/sst_mbh_2025338_20251204_05_g19.json"
      },
      {
        "var": "sst",
        "id": "sst_mbh_2025338_20251204_06_g19",
        "label": "12/04/2025, 06:00",
        "time_iso": "2025-12-04T06:00:00Z",
        "json_path": "data/mbh/sst/sst_mbh_2025338_20251204_06_g19.json"
      },
      {
        "var": "sst",
        "id": "sst_mbh_2025338_20251204_07_g19",
        "label": "12/04/2025, 07:00",
        "time_iso": "2025-12-04T07:00:00Z",
        "json_path": "data/mbh/sst/sst_mbh_2025338_20251204_07_g19.json"
      },
      {
        "var": "sst",
        "id": "sst_mbh_2025338_20251204_08_g19",
        "label": "12/04/2025, 08:00",
        "time_iso": "2025-12-04T08:00:00Z",
        "json_path": "data/mbh/sst/sst_mbh_2025338_20251204_08_g19.json"
      },
      {
        "var": "sst",
        "id": "sst_mbh_2025338_20251204_09_g19",
        "label": "12/04/2025, 09:00",
        "time_iso": "2025-12-04T09:00:00Z",
        "json_path": "data/mbh/sst/sst_mbh_2025338_20251204_09_g19.json"
      },
      {
        "var": "sst",
        "id": "sst_mbh_2025338_20251204_10_g19",
        "label": "12/04/2025, 10:00",
        "time_iso": "2025-12-04T10:00:00Z",
        "json_path": "data/mbh/sst/sst_mbh_2025338_20251204_10_g19.json"
      },
      {
        "var": "sst",
        "id": "sst_mbh_2025338_20251204_11_g19",
        "label": "12/04/2025, 11:00",
        "time_iso": "2025-12-04T11:00:00Z",
        "json_path": "data/mbh/sst/sst_mbh_2025338_20251204_11_g19.json"
      },
      {
        "var": "sst",
        "id": "sst_mbh_2025338_20251204_12_g19",
        "label": "12/04/2025, 12:00",
        "time_iso": "2025-12-04T12:00:00Z",
        "json_path": "data/mbh/sst/sst_mbh_2025338_20251204_12_g19.json"
      },
      {
        "var": "sst",
        "id": "sst_mbh_2025338_20251204_13_g19",
        "label": "12/04/2025, 13:00",
        "time_iso": "2025-12-04T13:00:00Z",
        "json_path": "data/mbh/sst/sst_mbh_2025338_20251204_13_g19.json"
      },
      {
        "var": "sst",
        "id": "sst_mbh_2025338_20251204_14_g19",
        "label": "12/04/2025, 14:00",
        "time_iso": "2025-12-04T14:00:00Z",
        "json_path": "data/mbh/sst/sst_mbh_2025338_20251204_14_g19.json"
      },
      {
        "var": "sst",
        "id": "sst_mbh_2025338_20251204_15_g19",
        "label": "12/04/2025, 15:00",
        "time_iso": "2025-12-04T15:00:00Z",
        "json_path": "data/mbh/sst/sst_mbh_2025338_20251204_15_g19.json"
      },
      {
        "var": "sst",
        "id": "sst_mbh_2025338_20251204_16_g19",
        "label": "12/04/2025, 16:00",
        "time_iso": "2025-12-04T16:00:00Z",
        "json_path": "data/mbh/sst/sst_mbh_2025338_20251204_16_g19.json"
      },
      {
        "var": "sst",
        "id": "sst_mbh_2025338_20251204_17_g19",
        "label": "12/04/2025, 17:00",
        "time_iso": "2025-12-04T17:00:00Z",
        "json_path": "data/mbh/sst/sst_mbh_2025338_20251204_17_g19.json"
      },
      {
        "var": "sst",
        "id": "sst_mbh_2025338_20251204_18_g19",
        "label": "12/04/2025, 18:00",
        "time_iso": "2025-12-04T18:00:00Z",
        "json_path": "data/mbh/sst/sst_mbh_2025338_20251204_18_g19.json"
      },
      {
        "var": "sst",
        "id": "sst_mbh_2025338_20251204_19_g19",
        "label": "12/04/2025, 19:00",
        "time_iso": "2025-12-04T19:00:00Z",
        "json_path": "data/mbh/sst/sst_mbh_2025338_20251204_19_g19.json"
      },
      {
        "var": "sst",
        "id": "sst_mbh_2025338_20251204_20_g19",
        "label": "12/04/2025, 20:00",
        "time_iso": "2025-12-04T20:00:00Z",
        "json_path": "data/mbh/sst/sst_mbh_2025338_20251204_20_g19.json"
      },
      {
        "var": "sst",
        "id": "sst_mbh_2025338_20251204_21_g19",
        "label": "12/04/2025, 21:00",
        "time_iso": "2025-12-04T21:00:00Z",
        "json_path": "data/mbh/sst/sst_mbh_2025338_20251204_21_g19.json"
      },
      {
        "var": "sst",
        "id": "sst_mbh_2025338_20251204_22_g19",
        "label": "12/04/2025, 22:00",
        "time_iso": "2025-12-04T22:00:00Z",
        "json_path": "data/mbh/sst/sst_mbh_2025338_20251204_22_g19.json"
      },
      {
        "var": "sst",
        "id": "sst_mbh_2025338_20251204_23_g19",
        "label": "12/04/2025, 23:00",
        "time_iso": "2025-12-04T23:00:00Z",
        "json_path": "data/mbh/sst/sst_mbh_2025338_20251204_23_g19.json"
      },
      {
        "var": "sst",
        "id": "sst_mbh_2025339_20251205_00_g19",
        "label": "12/05/2025, 00:00",
        "time_iso": "2025-12-05T00:00:00Z",
        "json_path": "data/mbh/sst/sst_mbh_2025339_20251205_00_g19.json"
      },
      {
        "var": "sst",
        "id": "sst_mbh_2025339_20251205_01_g19",
        "label": "12/05/2025, 01:00",
        "time_iso": "2025-12-05T01:00:00Z",
        "json_path": "data/mbh/sst/sst_mbh_2025339_20251205_01_g19.json"
      },
      {
        "var": "sst",
        "id": "sst_mbh_2025339_20251205_02_g19",
        "label": "12/05/2025, 02:00",
        "time_iso": "2025-12-05T02:00:00Z",
        "json_path": "data/mbh/sst/sst_mbh_2025339_20251205_02_g19.json"
      },
      {
        "var": "sst",
        "id": "sst_mbh_2025339_20251205_03_g19",
        "label": "12/05/2025, 03:00",
        "time_iso": "2025-12-05T03:00:00Z",
        "json_path": "data/mbh/sst/sst_mbh_2025339_20251205_03_g19.json"
      },
      {
        "var": "sst",
        "id": "sst_mbh_2025339_20251205_04_g19",
        "label": "12/05/2025, 04:00",
        "time_iso": "2025-12-05T04:00:00Z",
        "json_path": "data/mbh/sst/sst_mbh_2025339_20251205_04_g19.json"
      },
      {
        "var": "sst",
        "id": "sst_mbh_2025339_20251205_05_g19",
        "label": "12/05/2025, 05:00",
        "time_iso": "2025-12-05T05:00:00Z",
        "json_path": "data/mbh/sst/sst_mbh_2025339_20251205_05_g19.json"
      },
      {
        "var": "sst",
        "id": "sst_mbh_2025339_20251205_06_g19",
        "label": "12/05/2025, 06:00",
        "time_iso": "2025-12-05T06:00:00Z",
        "json_path": "data/mbh/sst/sst_mbh_2025339_20251205_06_g19.json"
      },
      {
        "var": "sst",
        "id": "sst_mbh_2025339_20251205_07_g19",
        "label": "12/05/2025, 07:00",
        "time_iso": "2025-12-05T07:00:00Z",
        "json_path": "data/mbh/sst/sst_mbh_2025339_20251205_07_g19.json"
      },
      {
        "var": "sst",
        "id": "sst_mbh_2025339_20251205_08_g19",
        "label": "12/05/2025, 08:00",
        "time_iso": "2025-12-05T08:00:00Z",
        "json_path": "data/mbh/sst/sst_mbh_2025339_20251205_08_g19.json"
      },
      {
        "var": "sst",
        "id": "sst_mbh_2025339_20251205_09_g19",
        "label": "12/05/2025, 09:00",
        "time_iso": "2025-12-05T09:00:00Z",
        "json_path": "data/mbh/sst/sst_mbh_2025339_20251205_09_g19.json"
      },
      {
        "var": "sst",
        "id": "sst_mbh_2025339_20251205_10_g19",
        "label": "12/05/2025, 10:00",
        "time_iso": "2025-12-05T10:00:00Z",
        "json_path": "data/mbh/sst/sst_mbh_2025339_20251205_10_g19.json"
      },
      {
        "var": "sst",
        "id": "sst_mbh_2025339_20251205_11_g19",
        "label": "12/05/2025, 11:00",
        "time_iso": "2025-12-05T11:00:00Z",
        "json_path": "data/mbh/sst/sst_mbh_2025339_20251205_11_g19.json"
      },
      {
        "var": "sst",
        "id": "sst_mbh_2025339_20251205_12_g19",
        "label": "12/05/2025, 12:00",
        "time_iso": "2025-12-05T12:00:00Z",
        "json_path": "data/mbh/sst/sst_mbh_2025339_20251205_12_g19.json"
      },
      {
        "var": "sst",
        "id": "sst_mbh_2025339_20251205_13_g19",
        "label": "12/05/2025, 13:00",
        "time_iso": "2025-12-05T13:00:00Z",
        "json_path": "data/mbh/sst/sst_mbh_2025339_20251205_13_g19.json"
      },
      {
        "var": "sst",
        "id": "sst_mbh_2025339_20251205_14_g19",
        "label": "12/05/2025, 14:00",
        "time_iso": "2025-12-05T14:00:00Z",
        "json_path": "data/mbh/sst/sst_mbh_2025339_20251205_14_g19.json"
      },
      {
        "var": "sst",
        "id": "sst_mbh_2025339_20251205_15_g19",
        "label": "12/05/2025, 15:00",
        "time_iso": "2025-12-05T15:00:00Z",
        "json_path": "data/mbh/sst/sst_mbh_2025339_20251205_15_g19.json"
      },
      {
        "var": "sst",
        "id": "sst_mbh_2025339_20251205_16_g19",
        "label": "12/05/2025, 16:00",
        "time_iso": "2025-12-05T16:00:00Z",
        "json_path": "data/mbh/sst/sst_mbh_2025339_20251205_16_g19.json"
      },
      {
        "var": "sst",
        "id": "sst_mbh_2025339_20251205_17_g19",
        "label": "12/05/2025, 17:00",
        "time_iso": "2025-12-05T17:00:00Z",
        "json_path": "data/mbh/sst/sst_mbh_2025339_20251205_17_g19.json"
      },
      {
        "var": "sst",
        "id": "sst_mbh_2025339_20251205_18_g19",
        "label": "12/05/2025, 18:00",
        "time_iso": "2025-12-05T18:00:00Z",
        "json_path": "data/mbh/sst/sst_mbh_2025339_20251205_18_g19.json"
      },
      {
        "var": "sst",
        "id": "sst_mbh_2025339_20251205_19_g19",
        "label": "12/05/2025, 19:00",
        "time_iso": "2025-12-05T19:00:00Z",
        "json_path": "data/mbh/sst/sst_mbh_2025339_20251205_19_g19.json"
      },
      {
        "var": "sst",
        "id": "sst_mbh_2025339_20251205_20_g19",
        "label": "12/05/2025, 20:00",
        "time_iso": "2025-12-05T20:00:00Z",
        "json_path": "data/mbh/sst/sst_mbh_2025339_20251205_20_g19.json"
      },
      {
        "var": "sst",
        "id": "sst_mbh_2025339_20251205_21_g19",
        "label": "12/05/2025, 21:00",
        "time_iso": "2025-12-05T21:00:00Z",
        "json_path": "data/mbh/sst/sst_mbh_2025339_20251205_21_g19.json"
      },
      {
        "var": "sst",
        "id": "sst_mbh_2025339_20251205_22_g19",
        "label": "12/05/2025, 22:00",
        "time_iso": "2025-12-05T22:00:00Z",
        "json_path": "data/mbh/sst/sst_mbh_2025339_20251205_22_g19.json"
      },
      {
        "var": "sst",
        "id": "sst_mbh_2025339_20251205_23_g19",
        "label": "12/05/2025, 23:00",
        "time_iso": "2025-12-05T23:00:00Z",
        "json_path": "data/mbh/sst/sst_mbh_2025339_20251205_23_g19.json"
      },
      {
        "var": "sst",
        "id": "sst_mbh_2025340_20251206_00_g19",
        "label": "12/06/2025, 00:00",
        "time_iso": "2025-12-06T00:00:00Z",
        "json_path": "data/mbh/sst/sst_mbh_2025340_20251206_00_g19.json"
      },
      {
        "var": "sst",
        "id": "sst_mbh_2025340_20251206_01_g19",
        "label": "12/06/2025, 01:00",
        "time_iso": "2025-12-06T01:00:00Z",
        "json_path": "data/mbh/sst/sst_mbh_2025340_20251206_01_g19.json"
      },
      {
        "var": "sst",
        "id": "sst_mbh_2025340_20251206_02_g19",
        "label": "12/06/2025, 02:00",
        "time_iso": "2025-12-06T02:00:00Z",
        "json_path": "data/mbh/sst/sst_mbh_2025340_20251206_02_g19.json"
      },
      {
        "var": "sst",
        "id": "sst_mbh_2025340_20251206_03_g19",
        "label": "12/06/2025, 03:00",
        "time_iso": "2025-12-06T03:00:00Z",
        "json_path": "data/mbh/sst/sst_mbh_2025340_20251206_03_g19.json"
      },
      {
        "var": "sst",
        "id": "sst_mbh_2025340_20251206_04_g19",
        "label": "12/06/2025, 04:00",
        "time_iso": "2025-12-06T04:00:00Z",
        "json_path": "data/mbh/sst/sst_mbh_2025340_20251206_04_g19.json"
      },
      {
        "var": "sst",
        "id": "sst_mbh_2025340_20251206_05_g19",
        "label": "12/06/2025, 05:00",
        "time_iso": "2025-12-06T05:00:00Z",
        "json_path": "data/mbh/sst/sst_mbh_2025340_20251206_05_g19.json"
      },
      {
        "var": "sst",
        "id": "sst_mbh_2025340_20251206_06_g19",
        "label": "12/06/2025, 06:00",
        "time_iso": "2025-12-06T06:00:00Z",
        "json_path": "data/mbh/sst/sst_mbh_2025340_20251206_06_g19.json"
      },
      {
        "var": "sst",
        "id": "sst_mbh_2025340_20251206_07_g19",
        "label": "12/06/2025, 07:00",
        "time_iso": "2025-12-06T07:00:00Z",
        "json_path": "data/mbh/sst/sst_mbh_2025340_20251206_07_g19.json"
      },
      {
        "var": "sst",
        "id": "sst_mbh_2025340_20251206_08_g19",
        "label": "12/06/2025, 08:00",
        "time_iso": "2025-12-06T08:00:00Z",
        "json_path": "data/mbh/sst/sst_mbh_2025340_20251206_08_g19.json"
      },
      {
        "var": "sst",
        "id": "sst_mbh_2025340_20251206_09_g19",
        "label": "12/06/2025, 09:00",
        "time_iso": "2025-12-06T09:00:00Z",
        "json_path": "data/mbh/sst/sst_mbh_2025340_20251206_09_g19.json"
      },
      {
        "var": "sst",
        "id": "sst_mbh_2025340_20251206_10_g19",
        "label": "12/06/2025, 10:00",
        "time_iso": "2025-12-06T10:00:00Z",
        "json_path": "data/mbh/sst/sst_mbh_2025340_20251206_10_g19.json"
      },
      {
        "var": "sst",
        "id": "sst_mbh_2025340_20251206_11_g19",
        "label": "12/06/2025, 11:00",
        "time_iso": "2025-12-06T11:00:00Z",
        "json_path": "data/mbh/sst/sst_mbh_2025340_20251206_11_g19.json"
      },
      {
        "var": "sst",
        "id": "sst_mbh_2025340_20251206_12_g19",
        "label": "12/06/2025, 12:00",
        "time_iso": "2025-12-06T12:00:00Z",
        "json_path": "data/mbh/sst/sst_mbh_2025340_20251206_12_g19.json"
      },
      {
        "var": "sst",
        "id": "sst_mbh_2025340_20251206_13_g19",
        "label": "12/06/2025, 13:00",
        "time_iso": "2025-12-06T13:00:00Z",
        "json_path": "data/mbh/sst/sst_mbh_2025340_20251206_13_g19.json"
      },
      {
        "var": "sst",
        "id": "sst_mbh_2025340_20251206_14_g19",
        "label": "12/06/2025, 14:00",
        "time_iso": "2025-12-06T14:00:00Z",
        "json_path": "data/mbh/sst/sst_mbh_2025340_20251206_14_g19.json"
      },
      {
        "var": "sst",
        "id": "sst_mbh_2025340_20251206_15_g19",
        "label": "12/06/2025, 15:00",
        "time_iso": "2025-12-06T15:00:00Z",
        "json_path": "data/mbh/sst/sst_mbh_2025340_20251206_15_g19.json"
      },
      {
        "var": "sst",
        "id": "sst_mbh_2025340_20251206_16_g19",
        "label": "12/06/2025, 16:00",
        "time_iso": "2025-12-06T16:00:00Z",
        "json_path": "data/mbh/sst/sst_mbh_2025340_20251206_16_g19.json"
      },
      {
        "var": "sst",
        "id": "sst_mbh_2025340_20251206_17_g19",
        "label": "12/06/2025, 17:00",
        "time_iso": "2025-12-06T17:00:00Z",
        "json_path": "data/mbh/sst/sst_mbh_2025340_20251206_17_g19.json"
      },
      {
        "var": "sst",
        "id": "sst_mbh_2025340_20251206_18_g19",
        "label": "12/06/2025, 18:00",
        "time_iso": "2025-12-06T18:00:00Z",
        "json_path": "data/mbh/sst/sst_mbh_2025340_20251206_18_g19.json"
      },
      {
        "var": "sst",
        "id": "sst_mbh_2025340_20251206_19_g19",
        "label": "12/06/2025, 19:00",
        "time_iso": "2025-12-06T19:00:00Z",
        "json_path": "data/mbh/sst/sst_mbh_2025340_20251206_19_g19.json"
      },
      {
        "var": "sst",
        "id": "sst_mbh_2025340_20251206_20_g19",
        "label": "12/06/2025, 20:00",
        "time_iso": "2025-12-06T20:00:00Z",
        "json_path": "data/mbh/sst/sst_mbh_2025340_20251206_20_g19.json"
      },
      {
        "var": "sst",
        "id": "sst_mbh_2025340_20251206_21_g19",
        "label": "12/06/2025, 21:00",
        "time_iso": "2025-12-06T21:00:00Z",
        "json_path": "data/mbh/sst/sst_mbh_2025340_20251206_21_g19.json"
      },
      {
        "var": "sst",
        "id": "sst_mbh_2025340_20251206_22_g19",
        "label": "12/06/2025, 22:00",
        "time_iso": "2025-12-06T22:00:00Z",
        "json_path": "data/mbh/sst/sst_mbh_2025340_20251206_22_g19.json"
      },
      {
        "var": "sst",
        "id": "sst_mbh_2025340_20251206_23_g19",
        "label": "12/06/2025, 23:00",
        "time_iso": "2025-12-06T23:00:00Z",
        "json_path": "data/mbh/sst/sst_mbh_2025340_20251206_23_g19.json"
      },
      {
        "var": "sst",
        "id": "sst_mbh_2025341_20251207_00_g19",
        "label": "12/07/2025, 00:00",
        "time_iso": "2025-12-07T00:00:00Z",
        "json_path": "data/mbh/sst/sst_mbh_2025341_20251207_00_g19.json"
      },
      {
        "var": "sst",
        "id": "sst_mbh_2025341_20251207_01_g19",
        "label": "12/07/2025, 01:00",
        "time_iso": "2025-12-07T01:00:00Z",
        "json_path": "data/mbh/sst/sst_mbh_2025341_20251207_01_g19.json"
      },
      {
        "var": "sst",
        "id": "sst_mbh_2025341_20251207_02_g19",
        "label": "12/07/2025, 02:00",
        "time_iso": "2025-12-07T02:00:00Z",
        "json_path": "data/mbh/sst/sst_mbh_2025341_20251207_02_g19.json"
      },
      {
        "var": "sst",
        "id": "sst_mbh_2025341_20251207_03_g19",
        "label": "12/07/2025, 03:00",
        "time_iso": "2025-12-07T03:00:00Z",
        "json_path": "data/mbh/sst/sst_mbh_2025341_20251207_03_g19.json"
      },
      {
        "var": "sst",
        "id": "sst_mbh_2025341_20251207_04_g19",
        "label": "12/07/2025, 04:00",
        "time_iso": "2025-12-07T04:00:00Z",
        "json_path": "data/mbh/sst/sst_mbh_2025341_20251207_04_g19.json"
      },
      {
        "var": "sst",
        "id": "sst_mbh_2025341_20251207_05_g19",
        "label": "12/07/2025, 05:00",
        "time_iso": "2025-12-07T05:00:00Z",
        "json_path": "data/mbh/sst/sst_mbh_2025341_20251207_05_g19.json"
      },
      {
        "var": "sst",
        "id": "sst_mbh_2025341_20251207_06_g19",
        "label": "12/07/2025, 06:00",
        "time_iso": "2025-12-07T06:00:00Z",
        "json_path": "data/mbh/sst/sst_mbh_2025341_20251207_06_g19.json"
      },
      {
        "var": "sst",
        "id": "sst_mbh_2025341_20251207_07_g19",
        "label": "12/07/2025, 07:00",
        "time_iso": "2025-12-07T07:00:00Z",
        "json_path": "data/mbh/sst/sst_mbh_2025341_20251207_07_g19.json"
      },
      {
        "var": "sst",
        "id": "sst_mbh_2025341_20251207_08_g19",
        "label": "12/07/2025, 08:00",
        "time_iso": "2025-12-07T08:00:00Z",
        "json_path": "data/mbh/sst/sst_mbh_2025341_20251207_08_g19.json"
      },
      {
        "var": "sst",
        "id": "sst_mbh_2025341_20251207_09_g19",
        "label": "12/07/2025, 09:00",
        "time_iso": "2025-12-07T09:00:00Z",
        "json_path": "data/mbh/sst/sst_mbh_2025341_20251207_09_g19.json"
      },
      {
        "var": "sst",
        "id": "sst_mbh_2025341_20251207_10_g19",
        "label": "12/07/2025, 10:00",
        "time_iso": "2025-12-07T10:00:00Z",
        "json_path": "data/mbh/sst/sst_mbh_2025341_20251207_10_g19.json"
      },
      {
        "var": "sst",
        "id": "sst_mbh_2025341_20251207_11_g19",
        "label": "12/07/2025, 11:00",
        "time_iso": "2025-12-07T11:00:00Z",
        "json_path": "data/mbh/sst/sst_mbh_2025341_20251207_11_g19.json"
      },
      {
        "var": "sst",
        "id": "sst_mbh_2025341_20251207_12_g19",
        "label": "12/07/2025, 12:00",
        "time_iso": "2025-12-07T12:00:00Z",
        "json_path": "data/mbh/sst/sst_mbh_2025341_20251207_12_g19.json"
      },
      {
        "var": "sst",
        "id": "sst_mbh_2025341_20251207_13_g19",
        "label": "12/07/2025, 13:00",
        "time_iso": "2025-12-07T13:00:00Z",
        "json_path": "data/mbh/sst/sst_mbh_2025341_20251207_13_g19.json"
      },
      {
        "var": "sst",
        "id": "sst_mbh_2025341_20251207_14_g19",
        "label": "12/07/2025, 14:00",
        "time_iso": "2025-12-07T14:00:00Z",
        "json_path": "data/mbh/sst/sst_mbh_2025341_20251207_14_g19.json"
      },
      {
        "var": "sst",
        "id": "sst_mbh_2025341_20251207_15_g19",
        "label": "12/07/2025, 15:00",
        "time_iso": "2025-12-07T15:00:00Z",
        "json_path": "data/mbh/sst/sst_mbh_2025341_20251207_15_g19.json"
      },
      {
        "var": "sst",
        "id": "sst_mbh_2025341_20251207_16_g19",
        "label": "12/07/2025, 16:00",
        "time_iso": "2025-12-07T16:00:00Z",
        "json_path": "data/mbh/sst/sst_mbh_2025341_20251207_16_g19.json"
      },
      {
        "var": "sst",
        "id": "sst_mbh_2025341_20251207_17_g19",
        "label": "12/07/2025, 17:00",
        "time_iso": "2025-12-07T17:00:00Z",
        "json_path": "data/mbh/sst/sst_mbh_2025341_20251207_17_g19.json"
      },
      {
        "var": "sst",
        "id": "sst_mbh_2025341_20251207_18_g19",
        "label": "12/07/2025, 18:00",
        "time_iso": "2025-12-07T18:00:00Z",
        "json_path": "data/mbh/sst/sst_mbh_2025341_20251207_18_g19.json"
      },
      {
        "var": "sst",
        "id": "sst_mbh_2025341_20251207_19_g19",
        "label": "12/07/2025, 19:00",
        "time_iso": "2025-12-07T19:00:00Z",
        "json_path": "data/mbh/sst/sst_mbh_2025341_20251207_19_g19.json"
      },
      {
        "var": "sst",
        "id": "sst_mbh_2025341_20251207_20_g19",
        "label": "12/07/2025, 20:00",
        "time_iso": "2025-12-07T20:00:00Z",
        "json_path": "data/mbh/sst/sst_mbh_2025341_20251207_20_g19.json"
      },
      {
        "var": "sst",
        "id": "sst_mbh_2025341_20251207_21_g19",
        "label": "12/07/2025, 21:00",
        "time_iso": "2025-12-07T21:00:00Z",
        "json_path": "data/mbh/sst/sst_mbh_2025341_20251207_21_g19.json"
      },
      {
        "var": "sst",
        "id": "sst_mbh_2025341_20251207_22_g19",
        "label": "12/07/2025, 22:00",
        "time_iso": "2025-12-07T22:00:00Z",
        "json_path": "data/mbh/sst/sst_mbh_2025341_20251207_22_g19.json"
      },
      {
        "var": "sst",
        "id": "sst_mbh_2025341_20251207_23_g19",
        "label": "12/07/2025, 23:00",
        "time_iso": "2025-12-07T23:00:00Z",
        "json_path": "data/mbh/sst/sst_mbh_2025341_20251207_23_g19.json"
      },
      {
        "var": "sst",
        "id": "sst_mbh_2025342_20251208_00_g19",
        "label": "12/08/2025, 00:00",
        "time_iso": "2025-12-08T00:00:00Z",
        "json_path": "data/mbh/sst/sst_mbh_2025342_20251208_00_g19.json"
      },
      {
        "var": "sst",
        "id": "sst_mbh_2025342_20251208_01_g19",
        "label": "12/08/2025, 01:00",
        "time_iso": "2025-12-08T01:00:00Z",
        "json_path": "data/mbh/sst/sst_mbh_2025342_20251208_01_g19.json"
      },
      {
        "var": "sst",
        "id": "sst_mbh_2025342_20251208_02_g19",
        "label": "12/08/2025, 02:00",
        "time_iso": "2025-12-08T02:00:00Z",
        "json_path": "data/mbh/sst/sst_mbh_2025342_20251208_02_g19.json"
      },
      {
        "var": "sst",
        "id": "sst_mbh_2025342_20251208_03_g19",
        "label": "12/08/2025, 03:00",
        "time_iso": "2025-12-08T03:00:00Z",
        "json_path": "data/mbh/sst/sst_mbh_2025342_20251208_03_g19.json"
      },
      {
        "var": "sst",
        "id": "sst_mbh_2025342_20251208_04_g19",
        "label": "12/08/2025, 04:00",
        "time_iso": "2025-12-08T04:00:00Z",
        "json_path": "data/mbh/sst/sst_mbh_2025342_20251208_04_g19.json"
      },
      {
        "var": "sst",
        "id": "sst_mbh_2025342_20251208_05_g19",
        "label": "12/08/2025, 05:00",
        "time_iso": "2025-12-08T05:00:00Z",
        "json_path": "data/mbh/sst/sst_mbh_2025342_20251208_05_g19.json"
      },
      {
        "var": "sst",
        "id": "sst_mbh_2025342_20251208_06_g19",
        "label": "12/08/2025, 06:00",
        "time_iso": "2025-12-08T06:00:00Z",
        "json_path": "data/mbh/sst/sst_mbh_2025342_20251208_06_g19.json"
      },
      {
        "var": "sst",
        "id": "sst_mbh_2025342_20251208_07_g19",
        "label": "12/08/2025, 07:00",
        "time_iso": "2025-12-08T07:00:00Z",
        "json_path": "data/mbh/sst/sst_mbh_2025342_20251208_07_g19.json"
      },
      {
        "var": "sst",
        "id": "sst_mbh_2025342_20251208_08_g19",
        "label": "12/08/2025, 08:00",
        "time_iso": "2025-12-08T08:00:00Z",
        "json_path": "data/mbh/sst/sst_mbh_2025342_20251208_08_g19.json"
      },
      {
        "var": "sst",
        "id": "sst_mbh_2025342_20251208_09_g19",
        "label": "12/08/2025, 09:00",
        "time_iso": "2025-12-08T09:00:00Z",
        "json_path": "data/mbh/sst/sst_mbh_2025342_20251208_09_g19.json"
      },
      {
        "var": "sst",
        "id": "sst_mbh_2025342_20251208_10_g19",
        "label": "12/08/2025, 10:00",
        "time_iso": "2025-12-08T10:00:00Z",
        "json_path": "data/mbh/sst/sst_mbh_2025342_20251208_10_g19.json"
      },
      {
        "var": "sst",
        "id": "sst_mbh_2025342_20251208_11_g19",
        "label": "12/08/2025, 11:00",
        "time_iso": "2025-12-08T11:00:00Z",
        "json_path": "data/mbh/sst/sst_mbh_2025342_20251208_11_g19.json"
      },
      {
        "var": "sst",
        "id": "sst_mbh_2025342_20251208_12_g19",
        "label": "12/08/2025, 12:00",
        "time_iso": "2025-12-08T12:00:00Z",
        "json_path": "data/mbh/sst/sst_mbh_2025342_20251208_12_g19.json"
      },
      {
        "var": "sst",
        "id": "sst_mbh_2025342_20251208_13_g19",
        "label": "12/08/2025, 13:00",
        "time_iso": "2025-12-08T13:00:00Z",
        "json_path": "data/mbh/sst/sst_mbh_2025342_20251208_13_g19.json"
      },
      {
        "var": "sst",
        "id": "sst_mbh_2025342_20251208_14_g19",
        "label": "12/08/2025, 14:00",
        "time_iso": "2025-12-08T14:00:00Z",
        "json_path": "data/mbh/sst/sst_mbh_2025342_20251208_14_g19.json"
      },
      {
        "var": "sst",
        "id": "sst_mbh_2025342_20251208_15_g19",
        "label": "12/08/2025, 15:00",
        "time_iso": "2025-12-08T15:00:00Z",
        "json_path": "data/mbh/sst/sst_mbh_2025342_20251208_15_g19.json"
      },
      {
        "var": "sst",
        "id": "sst_mbh_2025342_20251208_16_g19",
        "label": "12/08/2025, 16:00",
        "time_iso": "2025-12-08T16:00:00Z",
        "json_path": "data/mbh/sst/sst_mbh_2025342_20251208_16_g19.json"
      },
      {
        "var": "sst",
        "id": "sst_mbh_2025342_20251208_17_g19",
        "label": "12/08/2025, 17:00",
        "time_iso": "2025-12-08T17:00:00Z",
        "json_path": "data/mbh/sst/sst_mbh_2025342_20251208_17_g19.json"
      },
      {
        "var": "sst",
        "id": "sst_mbh_2025342_20251208_18_g19",
        "label": "12/08/2025, 18:00",
        "time_iso": "2025-12-08T18:00:00Z",
        "json_path": "data/mbh/sst/sst_mbh_2025342_20251208_18_g19.json"
      },
      {
        "var": "sst",
        "id": "sst_mbh_2025342_20251208_19_g19",
        "label": "12/08/2025, 19:00",
        "time_iso": "2025-12-08T19:00:00Z",
        "json_path": "data/mbh/sst/sst_mbh_2025342_20251208_19_g19.json"
      },
      {
        "var": "sst",
        "id": "sst_mbh_2025342_20251208_20_g19",
        "label": "12/08/2025, 20:00",
        "time_iso": "2025-12-08T20:00:00Z",
        "json_path": "data/mbh/sst/sst_mbh_2025342_20251208_20_g19.json"
      },
      {
        "var": "sst",
        "id": "sst_mbh_2025342_20251208_21_g19",
        "label": "12/08/2025, 21:00",
        "time_iso": "2025-12-08T21:00:00Z",
        "json_path": "data/mbh/sst/sst_mbh_2025342_20251208_21_g19.json"
      },
      {
        "var": "sst",
        "id": "sst_mbh_2025342_20251208_22_g19",
        "label": "12/08/2025, 22:00",
        "time_iso": "2025-12-08T22:00:00Z",
        "json_path": "data/mbh/sst/sst_mbh_2025342_20251208_22_g19.json"
      },
      {
        "var": "sst",
        "id": "sst_mbh_2025342_20251208_23_g19",
        "label": "12/08/2025, 23:00",
        "time_iso": "2025-12-08T23:00:00Z",
        "json_path": "data/mbh/sst/sst_mbh_2025342_20251208_23_g19.json"
      },
      {
        "var": "sst",
        "id": "sst_mbh_2025343_20251209_00_g19",
        "label": "12/09/2025, 00:00",
        "time_iso": "2025-12-09T00:00:00Z",
        "json_path": "data/mbh/sst/sst_mbh_2025343_20251209_00_g19.json"
      },
      {
        "var": "sst",
        "id": "sst_mbh_2025344_20251210_14_g19",
        "label": "12/10/2025, 14:00",
        "time_iso": "2025-12-10T14:00:00Z",
        "json_path": "data/mbh/sst/sst_mbh_2025344_20251210_14_g19.json"
      },
      {
        "var": "sst",
        "id": "sst_mbh_2025344_20251210_15_g19",
        "label": "12/10/2025, 15:00",
        "time_iso": "2025-12-10T15:00:00Z",
        "json_path": "data/mbh/sst/sst_mbh_2025344_20251210_15_g19.json"
      },
      {
        "var": "sst",
        "id": "sst_mbh_2025344_20251210_16_g19",
        "label": "12/10/2025, 16:00",
        "time_iso": "2025-12-10T16:00:00Z",
        "json_path": "data/mbh/sst/sst_mbh_2025344_20251210_16_g19.json"
      },
      {
        "var": "sst",
        "id": "sst_mbh_2025344_20251210_17_g19",
        "label": "12/10/2025, 17:00",
        "time_iso": "2025-12-10T17:00:00Z",
        "json_path": "data/mbh/sst/sst_mbh_2025344_20251210_17_g19.json"
      },
      {
        "var": "sst",
        "id": "sst_mbh_2025344_20251210_18_g19",
        "label": "12/10/2025, 18:00",
        "time_iso": "2025-12-10T18:00:00Z",
        "json_path": "data/mbh/sst/sst_mbh_2025344_20251210_18_g19.json"
      },
      {
        "var": "sst",
        "id": "sst_mbh_2025344_20251210_19_g19",
        "label": "12/10/2025, 19:00",
        "time_iso": "2025-12-10T19:00:00Z",
        "json_path": "data/mbh/sst/sst_mbh_2025344_20251210_19_g19.json"
      },
      {
        "var": "sst",
        "id": "sst_mbh_2025345_20251211_14_g19",
        "label": "12/11/2025, 14:00",
        "time_iso": "2025-12-11T14:00:00Z",
        "json_path": "data/mbh/sst/sst_mbh_2025345_20251211_14_g19.json"
      },
      {
        "var": "sst",
        "id": "sst_mbh_2025346_20251212_16_g19",
        "label": "12/12/2025, 16:00",
        "time_iso": "2025-12-12T16:00:00Z",
        "json_path": "data/mbh/sst/sst_mbh_2025346_20251212_16_g19.json"
      }
    ],
    "uv": [
      {
        "var": "uv",
        "id": "mbh_uv_grid",
        "label": "mbh_uv_grid",
        "time_iso": null,
        "json_path": "data/mbh/uv/mbh_uv_grid.json"
      },
      {
        "var": "uv",
        "id": "uv_mbh_2025322_20251118_cmems-duacs-v202506",
        "label": "11/18/2025",
        "time_iso": "2025-11-18T00:00:00Z",
        "json_path": "data/mbh/uv/uv_mbh_2025322_20251118_cmems-duacs-v202506.json"
      },
      {
        "var": "uv",
        "id": "uv_mbh_2025323_20251119_cmems-duacs-v202506",
        "label": "11/19/2025",
        "time_iso": "2025-11-19T00:00:00Z",
        "json_path": "data/mbh/uv/uv_mbh_2025323_20251119_cmems-duacs-v202506.json"
      },
      {
        "var": "uv",
        "id": "uv_mbh_2025324_20251120_cmems-duacs-v202506",
        "label": "11/20/2025",
        "time_iso": "2025-11-20T00:00:00Z",
        "json_path": "data/mbh/uv/uv_mbh_2025324_20251120_cmems-duacs-v202506.json"
      },
      {
        "var": "uv",
        "id": "uv_mbh_2025325_20251121_cmems-duacs-v202506",
        "label": "11/21/2025",
        "time_iso": "2025-11-21T00:00:00Z",
        "json_path": "data/mbh/uv/uv_mbh_2025325_20251121_cmems-duacs-v202506.json"
      },
      {
        "var": "uv",
        "id": "uv_mbh_2025326_20251122_cmems-duacs-v202506",
        "label": "11/22/2025",
        "time_iso": "2025-11-22T00:00:00Z",
        "json_path": "data/mbh/uv/uv_mbh_2025326_20251122_cmems-duacs-v202506.json"
      },
      {
        "var": "uv",
        "id": "uv_mbh_2025327_20251123_cmems-duacs-v202506",
        "label": "11/23/2025",
        "time_iso": "2025-11-23T00:00:00Z",
        "json_path": "data/mbh/uv/uv_mbh_2025327_20251123_cmems-duacs-v202506.json"
      },
      {
        "var": "uv",
        "id": "uv_mbh_2025328_20251124_cmems-duacs-v202506",
        "label": "11/24/2025",
        "time_iso": "2025-11-24T00:00:00Z",
        "json_path": "data/mbh/uv/uv_mbh_2025328_20251124_cmems-duacs-v202506.json"
      },
      {
        "var": "uv",
        "id": "uv_mbh_2025329_20251125_cmems-duacs-v202506",
        "label": "11/25/2025",
        "time_iso": "2025-11-25T00:00:00Z",
        "json_path": "data/mbh/uv/uv_mbh_2025329_20251125_cmems-duacs-v202506.json"
      },
      {
        "var": "uv",
        "id": "uv_mbh_2025330_20251126_cmems-duacs-v202506",
        "label": "11/26/2025",
        "time_iso": "2025-11-26T00:00:00Z",
        "json_path": "data/mbh/uv/uv_mbh_2025330_20251126_cmems-duacs-v202506.json"
      },
      {
        "var": "uv",
        "id": "uv_mbh_2025331_20251127_cmems-duacs-v202506",
        "label": "11/27/2025",
        "time_iso": "2025-11-27T00:00:00Z",
        "json_path": "data/mbh/uv/uv_mbh_2025331_20251127_cmems-duacs-v202506.json"
      },
      {
        "var": "uv",
        "id": "uv_mbh_2025332_20251128_cmems-duacs-v202506",
        "label": "11/28/2025",
        "time_iso": "2025-11-28T00:00:00Z",
        "json_path": "data/mbh/uv/uv_mbh_2025332_20251128_cmems-duacs-v202506.json"
      },
      {
        "var": "uv",
        "id": "uv_mbh_2025333_20251129_cmems-duacs-v202506",
        "label": "11/29/2025",
        "time_iso": "2025-11-29T00:00:00Z",
        "json_path": "data/mbh/uv/uv_mbh_2025333_20251129_cmems-duacs-v202506.json"
      },
      {
        "var": "uv",
        "id": "uv_mbh_2025334_20251130_cmems-duacs-v202506",
        "label": "11/30/2025",
        "time_iso": "2025-11-30T00:00:00Z",
        "json_path": "data/mbh/uv/uv_mbh_2025334_20251130_cmems-duacs-v202506.json"
      },
      {
        "var": "uv",
        "id": "uv_mbh_2025335_20251201_cmems-duacs-v202506",
        "label": "12/01/2025",
        "time_iso": "2025-12-01T00:00:00Z",
        "json_path": "data/mbh/uv/uv_mbh_2025335_20251201_cmems-duacs-v202506.json"
      },
      {
        "var": "uv",
        "id": "uv_mbh_2025336_20251202_cmems-duacs-v202506",
        "label": "12/02/2025",
        "time_iso": "2025-12-02T00:00:00Z",
        "json_path": "data/mbh/uv/uv_mbh_2025336_20251202_cmems-duacs-v202506.json"
      },
      {
        "var": "uv",
        "id": "uv_mbh_2025337_20251203_cmems-duacs-v202506",
        "label": "12/03/2025",
        "time_iso": "2025-12-03T00:00:00Z",
        "json_path": "data/mbh/uv/uv_mbh_2025337_20251203_cmems-duacs-v202506.json"
      },
      {
        "var": "uv",
        "id": "uv_mbh_2025338_20251204_cmems-duacs-v202506",
        "label": "12/04/2025",
        "time_iso": "2025-12-04T00:00:00Z",
        "json_path": "data/mbh/uv/uv_mbh_2025338_20251204_cmems-duacs-v202506.json"
      },
      {
        "var": "uv",
        "id": "uv_mbh_2025339_20251205_cmems-duacs-v202506",
        "label": "12/05/2025",
        "time_iso": "2025-12-05T00:00:00Z",
        "json_path": "data/mbh/uv/uv_mbh_2025339_20251205_cmems-duacs-v202506.json"
      },
      {
        "var": "uv",
        "id": "uv_mbh_2025340_20251206_cmems-duacs-v202506",
        "label": "12/06/2025",
        "time_iso": "2025-12-06T00:00:00Z",
        "json_path": "data/mbh/uv/uv_mbh_2025340_20251206_cmems-duacs-v202506.json"
      },
      {
        "var": "uv",
        "id": "uv_mbh_2025341_20251207_cmems-duacs-v202506",
        "label": "12/07/2025",
        "time_iso": "2025-12-07T00:00:00Z",
        "json_path": "data/mbh/uv/uv_mbh_2025341_20251207_cmems-duacs-v202506.json"
      },
      {
        "var": "uv",
        "id": "uv_mbh_2025342_20251208_cmems-duacs-v202506",
        "label": "12/08/2025",
        "time_iso": "2025-12-08T00:00:00Z",
        "json_path": "data/mbh/uv/uv_mbh_2025342_20251208_cmems-duacs-v202506.json"
      },
      {
        "var": "uv",
        "id": "uv_mbh_2025343_20251209_cmems-duacs-v202506",
        "label": "12/09/2025",
        "time_iso": "2025-12-09T00:00:00Z",
        "json_path": "data/mbh/uv/uv_mbh_2025343_20251209_cmems-duacs-v202506.json"
      },
      {
        "var": "uv",
        "id": "uv_mbh_2025344_20251210_cmems-duacs-v202506",
        "label": "12/10/2025",
        "time_iso": "2025-12-10T00:00:00Z",
        "json_path": "data/mbh/uv/uv_mbh_2025344_20251210_cmems-duacs-v202506.json"
      },
      {
        "var": "uv",
        "id": "uv_mbh_2025345_20251211_cmems-duacs-v202506",
        "label": "12/11/2025",
        "time_iso": "2025-12-11T00:00:00Z",
        "json_path": "data/mbh/uv/uv_mbh_2025345_20251211_cmems-duacs-v202506.json"
      },
      {
        "var": "uv",
        "id": "uv_mbh_2025346_20251212_cmems-duacs-v202506",
        "label": "12/12/2025",
        "time_iso": "2025-12-12T00:00:00Z",
        "json_path": "data/mbh/uv/uv_mbh_2025346_20251212_cmems-duacs-v202506.json"
      }
    ]
  },
  "grids": {
    "dir": "data/mbh/grids",
    "files": {
      "chl": "viirs_chl_750_grid.json",
      "sst": "goes_sst_1000_grid.json",
      "uv": "uv_12500_grid.json"
    }
  }
}